Business Name,Owner Name,Trade Type,Phone,Email,Website,City,State,Estimated Size (employees),Notes,Status,Date Contacted,Follow Up Date
"Pacific Drain Pros","Mark Rivera","Plumbing","(619) 555-0142","mark@pacificdrainpros.com","pacificdrainpros.com","San Diego","CA","6","Found on Google Maps - 4.2 stars, 38 reviews. No online booking.","Not Contacted","",""
"Central Coast HVAC","Dana Whitfield","HVAC","(805) 555-0278","dana@centralcoasthvac.com","centralcoasthvac.com","San Luis Obispo","CA","4","Solo owner + 3 techs. Website is outdated. Referred by a mutual contact.","Contacted","2026-03-10","2026-03-17"
"Bright Spark Electric","Jason Okafor","Electrical","(951) 555-0391","jason@brightsparkelec.com","brightsparkelec.com","Riverside","CA","8","Growing fast, mentioned struggling with missed calls on a Reddit thread.","Demo Scheduled","2026-03-12","2026-03-19"
"Vista Verde Landscaping","Carlos Mendez","Landscaping","(760) 555-0184","carlos@vistaverdelandscaping.com","vistaverdelandscaping.com","Oceanside","CA","10","Seasonal business, needs help with off-season follow-ups and reviews.","Not Contacted","",""
"Summit Painting Co","Angela Torres","Painting","(818) 555-0467","angela@summitpainting.co","summitpainting.co","Burbank","CA","5","Met at a local trade show. Interested in estimate automation.","Contacted","2026-03-14","2026-03-21"
